"303200023";"135305222112021NE000002";"2021NE000002";"08/01/2021";"NE";"Nota de Empenho";"Ordin·rio";"N„o se aplica";"22000";"MinistÈrio da Agricultura, Pecu·ria e Abastec";"22211";"Companhia Nacional de Abastecimento";"135305";"CONAB SEDE SUREG RIO DE JANEIRO";"22211";"COMPANHIA NACIONAL DE ABASTECIMENTO";"34106518000126";"INSTITUTO BRASILEIRO DE OFTALMOLOGIA S.A. - IBOL";"VALOR QUE SE EMPENHA REF SERVICOS MEDICOS PRESTADOS NOVEMBRO/2020 NF 161421 E 161422 DE 06/11/2020 VENCIMENTO 29/01/2021";"2";"OrÁamento da Seguridade Social";"A";"INICIAL (LOA)";"-3";"Inv·lido";"51";"CONTR.SOCIAL S/O LUCRO DAS PESSOAS JURIDICAS";"22211";"COMPANHIA NACIONAL DE ABASTECIMENTO";"20";"Agricultura";"301";"AtenÁ„o b·sica";"0032";"PROGRAMA DE GESTAO E MANUTENCAO DO PODER EXECUTIVO";"2004";"ASSISTENCIA MEDICA E ODONTOLOGICA AOS SERVIDORES CIVIS, EMPREGADOS, MILITARES E SEUS DEPENDENTES";"AssistÍncia MÈdica e OdontolÛgica";"20040001";"ASSISTENCIA MEDICA E ODONTOLOGICA AOS - NACIONAL";"0001";"ASSISTENCIA MEDICA E ODONTOLOGICA DE CIVIS - COMPLEMENTACAO DA UNIAO";"00";"NAO ATRIBUIDO";"SEM EMENDA";"3";"DESPESAS CORRENTES";"3";"Outras Despesas Correntes";"90";"Reserva de ContingÍncia";"39";"Outros ServiÁos de Terceiros - Pessoa JurÌdic";"21451000014/2021-28";"InexigÌvel";"II";"LEI 13.303 / 2016";"-2";"-1";"NAO SE APLICA";"934,13";"934,13";"1,0000"
"305100036";"170010000012021NE000023";"2021NE000023";"08/01/2021";"NE";"Nota de Empenho";"Estimativo";"N„o se aplica";"25000";"MinistÈrio da Economia";"25000";"MinistÈrio da Economia - Unidades com vÌnculo";"170010";"SECRETARIA DA RECEITA FEDERAL DO BRASIL-RFB";"00001";"TESOURO NACIONAL";"***.750.137-**";"WILLIAN CARLOS PACHECO RIO";"CONCESSAO  DE SUPRIMENTO DE  FUNDOS  PARA ATENDER DESPESAS COM A MANUTENCAO DA ADIDANCIA  TRIBUTARIA E ADUANEIRA DA RFB, EM MONTEVIDEU /URUGUAI, NO VALOR USD 3,000.00, AO CAMBIO DE R$ 5,3795. DOSSIE BANCO DO BRASIL 20210107000002205.";"1";"OrÁamento Fiscal";"A";"INICIAL (LOA)";"-3";"Inv·lido";"50";"RECURSOS N√O-FINANCEIROS DIRETAM. ARRECADADOS";"25103";"SEC ESPECIAL DA RECEITA FEDERAL DO BRASIL";"04";"AdministraÁ„o";"122";"AdministraÁ„o geral";"0032";"PROGRAMA DE GESTAO E MANUTENCAO DO PODER EXECUTIVO";"2000";"ADMINISTRACAO DA UNIDADE";"AdministraÁ„o de unidade";"20000001";"ADMINISTRACAO DA UNIDADE              - NACIONAL";"0002";"ADMINISTRACAO DA UNIDADE - RFB";"00";"NAO ATRIBUIDO";"SEM EMENDA";"3";"DESPESAS CORRENTES";"3";"Outras Despesas Correntes";"90";"Reserva de ContingÍncia";"30";"Material de Consumo";"10265.387189/2020-39";"Suprimento de Fundo";"I";"DECRETO 93.872 / 1986";"-2";"-1";"NAO SE APLICA";"16138,50";"16138,50";"1,0000"
"314500029";"257002000012021NE000004";"2021NE000004";"08/01/2021";"NE";"Nota de Empenho";"Global";"N„o se aplica";"36000";"MinistÈrio da Sa˙de";"36000";"MinistÈrio da Sa˙de - Unidades com vÌnculo di";"257002";"SECRETARIA DE VIGILANCIA EM SAUDE";"00001";"TESOURO NACIONAL";"257002";"SECRETARIA DE VIGILANCIA EM SAUDE";"INDENIZACOES E RESTITUICOES DE EXERCICIO ANTERIOR.";"2";"OrÁamento da Seguridade Social";"A";"INICIAL (LOA)";"-3";"Inv·lido";"53";"CONTRIBUICAO P/FINANCIAM.DA SEGURIDADE SOCIAL";"36901";"FUNDO NACIONAL DE SAUDE";"10";"Sa˙de";"122";"AdministraÁ„o geral";"5021";"GESTAO E ORGANIZACAO DO SUS";"20YQ";"APOIO INSTITUCIONAL PARA APRIMORAMENTO DO SUS";"";"20YQ0001";"APOIO INSTITUCIONAL PARA APRIMORAMENT - NACIONAL";"0003";"APOIO INSTITUCIONAL PARA ACOES DE REDUCAO DE RISCOS E AGRAVOS A SAUDE DA POPULACAO";"00";"NAO ATRIBUIDO";"SEM EMENDA";"3";"DESPESAS CORRENTES";"3";"Outras Despesas Correntes";"90";"Reserva de ContingÍncia";"92";"Despesas de ExercÌcios Anteriores";"-8";"N„o se Aplica";"SI";"SEM INFORMACAO";"-2";"-1";"NAO SE APLICA";"4000,00";"4000,00";"1,0000"
"313600024";"170485000012021NE000019";"2021NE000019";"08/01/2021";"NE";"Nota de Empenho";"Ordin·rio";"N„o se aplica";"25000";"MinistÈrio da Economia";"25915";"Fundo Constitucional do Distrito Federal";"170485";"DEPARTAMENTO DE SAUDE E ASSIST. DE PESSOAL";"00001";"TESOURO NACIONAL";"***.924.581-**";"ANGELA XIMENES DE SOUZA";"RESSARCIMENTO DE DESPESAS MEDICAS";"2";"OrÁamento da Seguridade Social";"A";"INICIAL (LOA)";"-3";"Inv·lido";"06";"CONTR.FUNDO DE SAUDE POL.MIL.BOMBEIROS DO DF";"73901";"FUNDO CONSTITUCIONAL DO DISTRITO FEDERAL-FCDF";"28";"Encargos especiais";"845";"Outras transferÍncias";"0903";"OPERACOES ESPECIAIS: TRANSFERENCIAS CONSTITUCIONAIS E AS DECORRENTES DE LEGISLACAO ESPECIFICA";"00FM";"ASSISTENCIA MEDICA E ODONTOLOGICA AS POLICIAS CIVIL E MILITAR E AO CORPO DE BOMBEIROS DO DISTRITO FEDERAL";"";"00FM0053";"ASSISTENCIA MEDICA E ODONTOLOGICA AS  - NO DISTRITO FEDERAL";"0002";"ASSISTENCIA MEDICA E ODONTOLOGICA AOS POLICIAIS MILITARES DO DF E SEUS DEPENDENTES.";"00";"NAO ATRIBUIDO";"SEM EMENDA";"3";"DESPESAS CORRENTES";"3";"Outras Despesas Correntes";"90";"Reserva de ContingÍncia";"93";"IndenizaÁıes e RestituiÁıes";"054-00066668/2020-82";"N„o se Aplica";"SI";"SEM INFORMACAO";"-2";"-1";"NAO SE APLICA";"680,00";"680,00";"1,0000"
"315900025";"154044152612021NE000001";"2021NE000001";"08/01/2021";"NE";"Nota de Empenho";"Estimativo";"N„o se aplica";"26000";"MinistÈrio da EducaÁ„o";"26275";"FundaÁ„o Universidade Federal do Acre";"154044";"FUNDACAO UNIVERSIDADE FEDERAL DO ACRE";"15261";"FUNDACAO UNIVERSIDADE FEDERAL DO ACRE";"154044";"FUNDACAO UNIVERSIDADE FEDERAL DO ACRE";"VALORES DOS SUBITENS INCORRETOS";"1";"OrÁamento Fiscal";"A";"INICIAL (LOA)";"-3";"Inv·lido";"00";"RECURSOS ORDINARIOS";"26275";"FUNDACAO UNIVERSIDADE FEDERAL DO ACRE";"12";"EducaÁ„o";"301";"AtenÁ„o b·sica";"0032";"PROGRAMA DE GESTAO E MANUTENCAO DO PODER EXECUTIVO";"212B";"BENEFICIOS OBRIGATORIOS AOS SERVIDORES CIVIS, EMPREGADOS, MILITARES E SEUS DEPENDENTES";"";"212B0012";"BENEFICIOS OBRIGATORIOS AOS SERVIDORE - NO ESTADO DO ACRE";"0009";"AUXILIO-FUNERAL E NATALIDADE DE CIVIS";"00";"NAO ATRIBUIDO";"SEM EMENDA";"3";"DESPESAS CORRENTES";"3";"Outras Despesas Correntes";"90";"Reserva de ContingÍncia";"08";"Outros BenefÌcios Assistenciais do servidor e";"23107.000277/2020-82";"N„o se Aplica";"SI";"SEM INFORMACAO";"-2";"-1";"NAO SE APLICA";"300000,00";"300000,00";"1,0000"
"312200022";"245209242092021NE000022";"2021NE000022";"08/01/2021";"NE";"Nota de Empenho";"Estimativo";"N„o se aplica";"24000";"MinistÈrio da CiÍncia, Tecnologia, InovaÁıes ";"24209";"Centro Nacional de Tecnologia EletrÙnica Avan";"245209";"CENTRO NACIONAL DE TECNOLOGIA ELETRONICA AVAN";"24209";"CENTRO NAC DE TECN ELETRONICA AVANCADA S/A";"18688117000175";"CONSORCIO GESTOR DO SISTEMA DE BILHETAGEM ELETRONICA NO";"AQUISICAO DE VALE TRANSPORTE PARA EXERCICIO 2021 - VALOR TOTAL ESTIMADO PARA_? JAN A JUN R$ 1.016,40 - LANCAMENTO PARCIAL PARA JAN E FEV/2021 -CONSORCIO DE BILHETAGEM NH";"1";"OrÁamento Fiscal";"A";"INICIAL (LOA)";"-3";"Inv·lido";"00";"RECURSOS ORDINARIOS";"24209";"CENTRO NAC DE TECN ELETRONICA AVANCADA S/A";"19";"CiÍncia e Tecnologia";"301";"AtenÁ„o b·sica";"0032";"PROGRAMA DE GESTAO E MANUTENCAO DO PODER EXECUTIVO";"212B";"BENEFICIOS OBRIGATORIOS AOS SERVIDORES CIVIS, EMPREGADOS, MILITARES E SEUS DEPENDENTES";"";"212B0043";"BENEFICIOS OBRIGATORIOS AOS SERVIDORE - NO ESTADO DO RIO GRA";"0003";"AUXILIO-TRANSPORTE DE CIVIS ATIVOS";"00";"NAO ATRIBUIDO";"SEM EMENDA";"3";"DESPESAS CORRENTES";"3";"Outras Despesas Correntes";"90";"Reserva de ContingÍncia";"49";"AuxÌlio-Transporte";"8920/2020-95";"N„o se Aplica";"SI";"SEM INFORMACAO";"-2";"-1";"NAO SE APLICA";"338,80";"338,80";"1,0000"
"313100030";"113206115042021NE000036";"2021NE000036";"08/01/2021";"NE";"Nota de Empenho";"Estimativo";"N„o se aplica";"32000";"MinistÈrio de Minas e Energia";"20303";"Ind˙strias Nucleares do Brasil";"113206";"INDUSTRIAS NUCLEARES DO BRASIL S/A - INB";"11504";"INDUSTRIAS NUCLEARES DO BRASIL S/A";"113206";"INDUSTRIAS NUCLEARES DO BRASIL S/A - INB";"022 DESPESAS COM DIARIAS PARA MEMBROS DOS CONSELHOS ADM/FISCAL?";"1";"OrÁamento Fiscal";"A";"INICIAL (LOA)";"-3";"Inv·lido";"50";"RECURSOS N√O-FINANCEIROS DIRETAM. ARRECADADOS";"32397";"INDUSTRIAS NUCLEARES DO BRASIL S/A";"25";"Energia";"122";"AdministraÁ„o geral";"0032";"PROGRAMA DE GESTAO E MANUTENCAO DO PODER EXECUTIVO";"2000";"ADMINISTRACAO DA UNIDADE";"AdministraÁ„o de unidade";"20000001";"ADMINISTRACAO DA UNIDADE              - NACIONAL";"0000";"ADMINISTRACAO DA UNIDADE - DESPESAS DIVERSAS";"00";"NAO ATRIBUIDO";"SEM EMENDA";"3";"DESPESAS CORRENTES";"3";"Outras Despesas Correntes";"90";"Reserva de ContingÍncia";"36";"Outros ServiÁos de Terceiros - Pessoa FÌsica";"-8";"N„o se Aplica";"SI";"SEM INFORMACAO";"-2";"-1";"NAO SE APLICA";"1000,00";"1000,00";"1,0000"
"311500016";"170394000012021NE000017";"2021NE000017";"08/01/2021";"NE";"Nota de Empenho";"Estimativo";"N„o se aplica";"25000";"MinistÈrio da Economia";"25915";"Fundo Constitucional do Distrito Federal";"170394";"FCDF±SSP±CORPO BOMBEIRO MILITAR DO DF";"00001";"TESOURO NACIONAL";"74434457000140";"ALBERTO CAIO TAMBORRINO IMPORTACAO E EXPORTACAO";"CONTRATO N∫ 53/2020 - EDITAL (45854414), QUE TEM POR OBJETO A CONTRATACAO DE EMPRESA PARA O FORNECIMENTO CONTINUO DE PECAS E ACESSORIOS NOVOS (ORIGINAIS OU GENUINOS) PARA VEICULOS DA MARCA LAND ROVER (ITEM 10 DO EDITAL) , PERIODO DE VIGENCIA: 02/10/2020 A 02/10/2021, EM  CONFORMIDADE COM O MEMORANDO N∫ 13/2021 - CBMDF/CEMEV/EXEC/AQUISI  E DECLARACAO DE ORCAMENTO CBMDF/DIOFI/SAOFI/SSAGO.";"1";"OrÁamento Fiscal";"A";"INICIAL (LOA)";"-3";"Inv·lido";"00";"RECURSOS ORDINARIOS";"73901";"FUNDO CONSTITUCIONAL DO DISTRITO FEDERAL-FCDF";"28";"Encargos especiais";"845";"Outras transferÍncias";"0903";"OPERACOES ESPECIAIS: TRANSFERENCIAS CONSTITUCIONAIS E AS DECORRENTES DE LEGISLACAO ESPECIFICA";"00NR";"MANUTENCAO DAS POLICIAS CIVIL E MILITAR E DO CORPO DE BOMBEIROS DO DISTRITO FEDERAL";"";"00NR0053";"MANUTENCAO DAS POLICIAS CIVIL E MILIT - NO DISTRITO FEDERAL";"0001";"MANUTENCAO DO CORPO DE BOMBEIROS DO DF";"00";"NAO ATRIBUIDO";"SEM EMENDA";"3";"DESPESAS CORRENTES";"3";"Outras Despesas Correntes";"90";"Reserva de ContingÍncia";"30";"Material de Consumo";"053-00074895/2020-18";"Preg„o";"SI";"LEI 10.520 / 2002";"-2";"-1";"NAO SE APLICA";"7000,00";"7000,00";"1,0000"
"306400018";"154043152602021NE000010";"2021NE000010";"08/01/2021";"NE";"Nota de Empenho";"Estimativo";"N„o se aplica";"26000";"MinistÈrio da EducaÁ„o";"26274";"FundaÁ„o Universidade Federal de Uberl‚ndia";"154043";"FUNDACAO UNIVERSIDADE FEDERAL DE UBERLANDIA";"15260";"FUNDACAO UNIVERSIDADE FEDERAL DE UBERLANDIA";"154043";"FUNDACAO UNIVERSIDADE FEDERAL DE UBERLANDIA";"VALOR QUE SE EMPENHA PARA COBRIR DESPESA COM FOLHA DE PAGAMENTO DE PESSOAL NO CORRENTE EXERCICIO. PROCESSO SEI 23117.000593/2021-35.";"2";"OrÁamento da Seguridade Social";"A";"INICIAL (LOA)";"-3";"Inv·lido";"51";"CONTR.SOCIAL S/O LUCRO DAS PESSOAS JURIDICAS";"26274";"FUNDACAO UNIVERSIDADE FEDERAL DE UBERLANDIA";"09";"PrevidÍncia social";"272";"PrevidÍncia do regime estatut·rio";"0032";"PROGRAMA DE GESTAO E MANUTENCAO DO PODER EXECUTIVO";"0181";"APOSENTADORIAS E PENSOES CIVIS DA UNIAO";"Pagamento de Aposentadorias e Pensıes";"01810031";"APOSENTADORIAS E PENSOES CIVIS DA UNI - NO ESTADO DE MINAS G";"0000";"APOSENTADORIAS E PENSOES CIVIS DA UNIAO";"00";"NAO ATRIBUIDO";"SEM EMENDA";"3";"DESPESAS CORRENTES";"1";"Pessoal e Encargos Sociais";"90";"Reserva de ContingÍncia";"03";"Pensıes do RPPS e do militar";"23117.000593/2021-35";"N„o se Aplica";"SI";"SEM INFORMACAO";"-2";"-1";"NAO SE APLICA";"17686798,00";"17686798,00";"1,0000"
"305700024";"158718264482021NE000002";"2021NE000002";"08/01/2021";"NE";"Nota de Empenho";"Estimativo";"N„o se aplica";"26000";"MinistÈrio da EducaÁ„o";"26448";"Universidade Federal do Sul e Sudeste do Par·";"158718";"UNIVERSIDADE FEDERAL DO SUL E SUDESTE DO PARA";"26448";"UNIVERSIDADE FEDERAL DO SUL E SUDESTE DO PARA";"RB0038183";"PROVENTOS - PESSOAL CIVIL";"EMPENHO ESTIMATIVO PARA ATENDER DESPESA COM PROVENTOS DE SERVIDOR CIVIL INATIVO DO REGIME PROPRIO DE PREVIDENCIA-RPPS DA FOLHA DE PESSOAL DO EXERCICIO 2021 DO ORGAO:26448. UPAG-PROGEP. PROCESSO:23479.017786/2020-35.";"2";"OrÁamento da Seguridade Social";"A";"INICIAL (LOA)";"-3";"Inv·lido";"51";"CONTR.SOCIAL S/O LUCRO DAS PESSOAS JURIDICAS";"26448";"UNIV.FED.DO SUL E SUDESTE DO PARA - UNIFESSPA";"09";"PrevidÍncia social";"272";"PrevidÍncia do regime estatut·rio";"0032";"PROGRAMA DE GESTAO E MANUTENCAO DO PODER EXECUTIVO";"0181";"APOSENTADORIAS E PENSOES CIVIS DA UNIAO";"Pagamento de Aposentadorias e Pensıes";"01810015";"APOSENTADORIAS E PENSOES CIVIS DA UNI - NO ESTADO DO PARA";"0000";"APOSENTADORIAS E PENSOES CIVIS DA UNIAO";"00";"NAO ATRIBUIDO";"SEM EMENDA";"3";"DESPESAS CORRENTES";"1";"Pessoal e Encargos Sociais";"90";"Reserva de ContingÍncia";"01";"Aposentadorias do RPPS, Reserva Remunerada e ";"23479.017786/2020-35";"N„o se Aplica";"SI";"SEM INFORMACAO";"-2";"-1";"NAO SE APLICA";"137339,41";"137339,41";"1,0000"
"304100025";"393001392502021NE000049";"2021NE000049";"08/01/2021";"NE";"Nota de Empenho";"Ordin·rio";"N„o se aplica";"39000";"MinistÈrio da Infraestrutura";"39250";"AgÍncia Nacional de Transportes Terrestres";"393001";"AGENCIA NACIONAL DE TRANSPORTES TERRESTRES";"39250";"AGENCIA NACIONAL DE TRANSPORTES TERRESTRES";"***.341.274-**";"HUGO LEONARDO CUNHA RODRIGUES";"DESPESA REFERENTE A RESSARCIMENTO A SERVIDOR QUE REALIZOU OS PAGAMENTO COM RECURSOS PROPRIOS REFERENTES AO ABASTECIMENTO DE 2 VIATURAS.?PROCESSO 50500.137460/2020-81";"1";"OrÁamento Fiscal";"A";"INICIAL (LOA)";"-3";"Inv·lido";"50";"RECURSOS N√O-FINANCEIROS DIRETAM. ARRECADADOS";"39250";"AGENCIA NAC. DE TRANSPORTES TERRESTRES ± ANTT";"26";"Transporte";"122";"AdministraÁ„o geral";"0032";"PROGRAMA DE GESTAO E MANUTENCAO DO PODER EXECUTIVO";"2000";"ADMINISTRACAO DA UNIDADE";"AdministraÁ„o de unidade";"20000001";"ADMINISTRACAO DA UNIDADE              - NACIONAL";"0002";"OUTRAS DESPESAS ADMINISTRATIVAS";"00";"NAO ATRIBUIDO";"SEM EMENDA";"3";"DESPESAS CORRENTES";"3";"Outras Despesas Correntes";"90";"Reserva de ContingÍncia";"93";"IndenizaÁıes e RestituiÁıes";"50500.137460/2020-81";"N„o se Aplica";"SI";"SEM INFORMACAO";"-2";"-1";"NAO SE APLICA";"660,06";"660,06";"1,0000"
"313700019";"170146000012021NE000001";"2021NE000001";"08/01/2021";"NE";"Nota de Empenho";"Estimativo";"N„o se aplica";"25000";"MinistÈrio da Economia";"25000";"MinistÈrio da Economia - Unidades com vÌnculo";"170146";"DELEGACIA DA RFB EM OSASCO";"00001";"TESOURO NACIONAL";"170146";"DELEGACIA DA RFB EM OSASCO";"ATENDER DESPESAS COM DIARIAS REGIONAIS NO EXERCICIO.";"1";"OrÁamento Fiscal";"A";"INICIAL (LOA)";"-3";"Inv·lido";"50";"RECURSOS N√O-FINANCEIROS DIRETAM. ARRECADADOS";"25103";"SEC ESPECIAL DA RECEITA FEDERAL DO BRASIL";"04";"AdministraÁ„o";"125";"NormatizaÁ„o e fiscalizaÁ„o";"0032";"PROGRAMA DE GESTAO E MANUTENCAO DO PODER EXECUTIVO";"2237";"AUDITORIA E FISCALIZACAO TRIBUTARIA E ADUANEIRA";"";"22370001";"AUDITORIA E FISCALIZACAO TRIBUTARIA E - NACIONAL";"0000";"AUDITORIA E FISCALIZACAO TRIBUTARIA E ADUANEIRA - DESPESAS DIVERSAS";"00";"NAO ATRIBUIDO";"SEM EMENDA";"3";"DESPESAS CORRENTES";"3";"Outras Despesas Correntes";"90";"Reserva de ContingÍncia";"14";"Di·rias - Civil";"-8";"N„o se Aplica";"SI";"SEM INFORMACAO";"-2";"-1";"NAO SE APLICA";"10,00";"10,00";"1,0000"
"309700015";"113206115042021NE000085";"2021NE000085";"08/01/2021";"NE";"Nota de Empenho";"Global";"N„o se aplica";"32000";"MinistÈrio de Minas e Energia";"20303";"Ind˙strias Nucleares do Brasil";"113206";"INDUSTRIAS NUCLEARES DO BRASIL S/A - INB";"11504";"INDUSTRIAS NUCLEARES DO BRASIL S/A";"00331788000623";"AIR LIQUIDE BRASIL LTDA";"16 C2/16/012 - FORNECIMENTO PARCELADO DE GAS CARBONICO P/ INB RESENDE";"1";"OrÁamento Fiscal";"A";"INICIAL (LOA)";"-3";"Inv·lido";"50";"RECURSOS N√O-FINANCEIROS DIRETAM. ARRECADADOS";"32397";"INDUSTRIAS NUCLEARES DO BRASIL S/A";"25";"Energia";"662";"ProduÁ„o industrial";"2206";"POLITICA NUCLEAR";"2482";"FABRICACAO DO COMBUSTIVEL NUCLEAR";"";"24820001";"FABRICACAO DO COMBUSTIVEL NUCLEAR     - NACIONAL";"0000";"FABRICACAO DO COMBUSTIVEL NUCLEAR - DESPESAS DIVERSAS";"00";"NAO ATRIBUIDO";"SEM EMENDA";"3";"DESPESAS CORRENTES";"3";"Outras Despesas Correntes";"90";"Reserva de ContingÍncia";"30";"Material de Consumo";"CPLAP.N 2019/06/0061";"Preg„o";"SI";"LEI 10.520 / 2002";"-2";"-1";"NAO SE APLICA";"150000,00";"150000,00";"1,0000"
"310900201";"159003264132021NE000010";"2021NE000010";"08/01/2021";"NE";"Nota de Empenho";"Estimativo";"N„o se aplica";"26000";"MinistÈrio da EducaÁ„o";"26413";"Instituto Federal do Tri‚ngulo Mineiro";"159003";"INST.FED.TRIANG.MINEIRO/CAMPUS PATOS DE MINAS";"26413";"INST.FED.DE EDUC.,CIENC.E TEC.DO TRIA.MINEIRO";"170502";"SECRETARIA DO TESOURO NACIONAL/COFIN/STN";"ATENDER A DEMANDA DO IFTM, CAMPUS PATOS DE MINAS, REF. AO PAGAMENTO DE PIS-PASEP NO EXERCICIO DE 2021. PROCESSO NÅ: 23494.000071/2021-36.";"1";"OrÁamento Fiscal";"A";"INICIAL (LOA)";"-3";"Inv·lido";"00";"RECURSOS ORDINARIOS";"26413";"INST.FED.DE EDUC.,CIENC.E TEC.DO TRIA.MINEIRO";"12";"EducaÁ„o";"363";"Ensino profissional";"5012";"EDUCACAO PROFISSIONAL E TECNOLOGICA";"20RL";"FUNCIONAMENTO DAS INSTITUICOES DA REDE FEDERAL DE EDUCACAO PROFISSIONAL, CIENTIFICA E TECNOLOGICA";"PRONATEC";"20RL0031";"FUNCIONAMENTO DAS INSTITUICOES DA RED - NO ESTADO DE MINAS G";"0000";"FUNCIONAMENTO DAS INSTITUICOES DA REDE FEDERAL DE EDUCACAO PROFISSIONAL, CIENTIFICA E TECNOLOGICA";"00";"NAO ATRIBUIDO";"SEM EMENDA";"3";"DESPESAS CORRENTES";"3";"Outras Despesas Correntes";"91";"APLICACOES DIRETAS - OPER.INTRA-ORCAMENTARIAS";"47";"ObrigaÁıes Tribut·rias e Contributivas";"23494.000071/2021-36";"N„o se Aplica";"SI";"SEM INFORMACAO";"-2";"-1";"NAO SE APLICA";"1,00";"1,00";"1,0000"
"303900023";"253002362122021NE000016";"2021NE000016";"08/01/2021";"NE";"Nota de Empenho";"Estimativo";"N„o se aplica";"36000";"MinistÈrio da Sa˙de";"36212";"AgÍncia Nacional de Vigil‚ncia Sanit·ria";"253002";"AGENCIA NACIONAL DE VIGILANCIA SANITARIA";"36212";"AGENCIA NACIONAL DE VIGILANCIA SANITARIA";"09215207000158";"MERU VIAGENS EIRELI";"ATENDER CONTRATACAO DE EMPRESA PARA PRESTACAO DE SERVICO DE AGENCIAMENTO DE  ?VIAGENS E SERVICOS CORRELATOS";"2";"OrÁamento da Seguridade Social";"A";"INICIAL (LOA)";"-3";"Inv·lido";"74";"TX/MUL.P/PODER DE POLICIA E MUL.PROV.PROC.JUD";"36212";"AGENCIA NACIONAL DE VIGILANCIA SANITARIA";"10";"Sa˙de";"304";"Vigil‚ncia sanit·ria";"5023";"VIGILANCIA EM SAUDE";"8719";"VIGILANCIA SANITARIA DE PRODUTOS, SERVICOS E AMBIENTES";"Vigil‚ncia Sanit·ria";"87190001";"VIGILANCIA SANITARIA DE PRODUTOS, SER - NACIONAL";"0000";"VIGILANCIA SANITARIA DE PRODUTOS, SERVICOS E AMBIENTES - DESPESAS DIVERSAS";"00";"NAO ATRIBUIDO";"SEM EMENDA";"3";"DESPESAS CORRENTES";"3";"Outras Despesas Correntes";"90";"Reserva de ContingÍncia";"39";"Outros ServiÁos de Terceiros - Pessoa JurÌdic";"25351.908239/2018-16";"Preg„o";"SI";"LEI 10.520 / 2002";"-2";"-1";"NAO SE APLICA";"1000,00";"1000,00";"1,0000"
"313600023";"153978262902021NE000009";"2021NE000009";"08/01/2021";"NE";"Nota de Empenho";"Estimativo";"N„o se aplica";"26000";"MinistÈrio da EducaÁ„o";"26290";"Instituto Nacional de Estudos e Pesquisas Edu";"153978";"INST.NACIONAL DE EST.E PESQUISAS EDUCACIONAIS";"26290";"INSTITUTO NACIONAL DE EST.E PESQ.EDUCACIONAIS";"01017250000105";"VOETUR TURISMO E REPRESENTACOES LTDA";"CONTRATO N∫ 26/2017 - 3∫ TERMO ADITIVO - APOSTILAMENTO MUDANCA EXERCICIO - PASSAGENS - ENEM - DGP - PROCESSO 23036.006583/2017-27 - SEI N∫ (DEO - 0631459).";"1";"OrÁamento Fiscal";"A";"INICIAL (LOA)";"-3";"Inv·lido";"08";"FUNDO SOCIAL-PARC.DEST.EDUCA«√O P⁄BL.E SA⁄DE";"26290";"INEP-INST.NAC.DE ESTUDOS E PESQ.EDUCACIONAIS";"12";"EducaÁ„o";"368";"EducaÁ„o b·sica";"5014";"ESTATISTICAS E AVALIACOES EDUCACIONAIS";"20RM";"EXAMES E AVALIACOES DA EDUCACAO BASICA";"";"20RM0001";"EXAMES E AVALIACOES DA EDUCACAO BASIC - NACIONAL";"0001";"EXAME NACIONAL DO ENSINO MEDIO - ENEM";"00";"NAO ATRIBUIDO";"SEM EMENDA";"3";"DESPESAS CORRENTES";"3";"Outras Despesas Correntes";"90";"Reserva de ContingÍncia";"33";"Passagens e Despesas com LocomoÁ„o";"23036.006583/2017-27";"Preg„o";"SI";"LEI 10.520 / 2002";"-2";"-1";"NAO SE APLICA";"130365,20";"130365,20";"1,0000"
"312400030";"150233152602021NE000002";"2021NE000002";"08/01/2021";"NE";"Nota de Empenho";"Estimativo";"N„o se aplica";"26000";"MinistÈrio da EducaÁ„o";"26274";"FundaÁ„o Universidade Federal de Uberl‚ndia";"150233";"HOSPITAL DE CLINICAS DA UFU";"15260";"FUNDACAO UNIVERSIDADE FEDERAL DE UBERLANDIA";"170010";"SECRETARIA DA RECEITA FEDERAL DO BRASIL-RFB";"VALOR QUE SE EMPENHA PARA COBRIR DESPESA COM FOLHA DE PAGAMENTO DE PESSOAL NO CORRENTE EXERCICIO. PROCESSO SEI 23117.000604/2021-87.";"2";"OrÁamento da Seguridade Social";"A";"INICIAL (LOA)";"-3";"Inv·lido";"51";"CONTR.SOCIAL S/O LUCRO DAS PESSOAS JURIDICAS";"26396";"HOSP.DAS CLINICAS DA UNIV.FED.DE UBERLANDIA";"12";"EducaÁ„o";"846";"Outros encargos especiais";"0032";"PROGRAMA DE GESTAO E MANUTENCAO DO PODER EXECUTIVO";"09HB";"CONTRIBUICAO DA UNIAO, DE SUAS AUTARQUIAS E FUNDACOES PARA O CUSTEIO DO REGIME DE PREVIDENCIA DOS SERVIDORES PUBLICOS FEDERAIS";"";"09HB0031";"CONTRIBUICAO DA UNIAO, DE SUAS AUTARQ - NO ESTADO DE MINAS G";"0000";"CONTRIBUICAO DA UNIAO, DE SUAS AUTARQUIAS E FUNDACOES PARA O CUSTEIO DO REGIME DE PREVIDENCIA DOS SERVIDORES PUBLICOS FEDERAIS";"00";"NAO ATRIBUIDO";"SEM EMENDA";"3";"DESPESAS CORRENTES";"1";"Pessoal e Encargos Sociais";"91";"APLICACOES DIRETAS - OPER.INTRA-ORCAMENTARIAS";"13";"ObrigaÁıes Patronais";"23117.000604/2021-87";"N„o se Aplica";"SI";"SEM INFORMACAO";"-2";"-1";"NAO SE APLICA";"40461031,00";"40461031,00";"1,0000"
"310100018";"170175000012021NE000001";"2021NE000001";"08/01/2021";"NE";"Nota de Empenho";"Estimativo";"N„o se aplica";"25000";"MinistÈrio da Economia";"25000";"MinistÈrio da Economia - Unidades com vÌnculo";"170175";"SUPERINTENDENCIA REG.ADM.DO ME-RIO GRANDE SUL";"00001";"TESOURO NACIONAL";"170175";"SUPERINTENDENCIA REG.ADM.DO ME-RIO GRANDE SUL";"EMPENHO PARA ATENDER DESPESAS COM PAGAMENTO DE AUXILIO FUNERAL A SERVIDORES E EX-SERVIDORES DO ME/RS.";"1";"OrÁamento Fiscal";"A";"INICIAL (LOA)";"-3";"Inv·lido";"00";"RECURSOS ORDINARIOS";"25101";"MINISTERIO DA ECONOMIA - ME";"04";"AdministraÁ„o";"301";"AtenÁ„o b·sica";"0032";"PROGRAMA DE GESTAO E MANUTENCAO DO PODER EXECUTIVO";"212B";"BENEFICIOS OBRIGATORIOS AOS SERVIDORES CIVIS, EMPREGADOS, MILITARES E SEUS DEPENDENTES";"";"212B0001";"BENEFICIOS OBRIGATORIOS AOS SERVIDORE - NACIONAL";"0009";"AUXILIO-FUNERAL E NATALIDADE DE CIVIS";"00";"NAO ATRIBUIDO";"SEM EMENDA";"3";"DESPESAS CORRENTES";"3";"Outras Despesas Correntes";"90";"Reserva de ContingÍncia";"08";"Outros BenefÌcios Assistenciais do servidor e";"-8";"N„o se Aplica";"SI";"SEM INFORMACAO";"-2";"-1";"NAO SE APLICA";"50000,00";"50000,00";"1,0000"
"303700024";"170339000012021NE000002";"2021NE000002";"08/01/2021";"NE";"Nota de Empenho";"Estimativo";"N„o se aplica";"25000";"MinistÈrio da Economia";"25000";"MinistÈrio da Economia - Unidades com vÌnculo";"170339";"COORDENACAO-GERAL DE PESQ.INVESTIGACAO DA RFB";"00001";"TESOURO NACIONAL";"-11";"InformaÁ„o protegida por sigilo nos termos da legislaÁ„";"InformaÁ„o protegida por sigilo nos termos da legislaÁ„o vigente";"1";"OrÁamento Fiscal";"A";"INICIAL (LOA)";"-3";"Inv·lido";"50";"RECURSOS N√O-FINANCEIROS DIRETAM. ARRECADADOS";"25103";"SEC ESPECIAL DA RECEITA FEDERAL DO BRASIL";"04";"AdministraÁ„o";"125";"NormatizaÁ„o e fiscalizaÁ„o";"0032";"PROGRAMA DE GESTAO E MANUTENCAO DO PODER EXECUTIVO";"2237";"AUDITORIA E FISCALIZACAO TRIBUTARIA E ADUANEIRA";"";"22370001";"AUDITORIA E FISCALIZACAO TRIBUTARIA E - NACIONAL";"2866";"ACOES DE CARATER SIGILOSO";"00";"NAO ATRIBUIDO";"SEM EMENDA";"3";"DESPESAS CORRENTES";"3";"Outras Despesas Correntes";"90";"Reserva de ContingÍncia";"36";"Outros ServiÁos de Terceiros - Pessoa FÌsica";"17507.720001/2021-17";"Suprimento de Fundo";"II";"DECRETO 93.872 / 1986";"-2";"-1";"NAO SE APLICA";"40000,00";"40000,00";"1,0000"
"312900020";"364150362012021NE000005";"2021NE000005";"08/01/2021";"NE";"Nota de Empenho";"Ordin·rio";"N„o se aplica";"24000";"MinistÈrio da CiÍncia, Tecnologia, InovaÁıes ";"20501";"Conselho Nacional de Desenvolvimento CientÌfi";"364150";"CNPQ - ATIVIDADES NO EXTERIOR";"36201";"CONSELHO NAC.DE DESENV.CIENTIFICO TECNOLOGICO";"364150";"CNPQ - ATIVIDADES NO EXTERIOR";"PARA ATENDER DESPESA BANCARIA DA FOLHA DE PAGAMENTO DE BOLSAS NO EXTERIOR.";"1";"OrÁamento Fiscal";"A";"INICIAL (LOA)";"-3";"Inv·lido";"-1";"Sem informaÁ„o";"24201";"CONSELHO NAC.DE DESENV.CIENTIF.E TECNOLOGICO";"19";"CiÍncia e Tecnologia";"572";"Desenvolvimento tecnolÛgico e engenharia";"2208";"TECNOLOGIAS APLICADAS, INOVACAO E DESENVOLVIMENTO SUSTENTAVEL";"00RL";"FORMACAO E EXPANSAO DA CAPACITACAO DE PESSOAL QUALIFICADO EM ATIVIDADES DE PESQUISA TECNOLOGICA, EMPREENDEDORISMO E INOVACAO";"";"00RL0001";"FORMACAO E EXPANSAO DA CAPACITACAO DE - NACIONAL";"0001";"BOLSAS PARA DESENVOLVIMENTO TECNOLOGICO, EMPREENDEDORISMO E INOVACAO";"00";"NAO ATRIBUIDO";"SEM EMENDA";"3";"DESPESAS CORRENTES";"3";"Outras Despesas Correntes";"90";"Reserva de ContingÍncia";"39";"Outros ServiÁos de Terceiros - Pessoa JurÌdic";"-8";"N„o se Aplica";"SI";"SEM INFORMACAO";"-2";"-1";"NAO SE APLICA";"20,00";"106,36";"0,1880"
